{
  "template_id": "tpl_cap0",
  "params": {
    "thresholds": {"conf_accept": 0.65},
    "cooldown_s": 0,
    "emit_caps": {"per_min": 0, "per_day": 0}
  },
  "scope": {"symbols": ["ETHUSDT"], "levels": ["A"]},
  "safety": {"abstain_rules": [], "failover": "restricted"},
  "meta": {"created_ts": 1700000000001, "author": "gpt"}
}
